{
  "schemaVersion": 1,
  "packVersion": "0.1.78+18",
  "nodes": [
    {
      "id": "Button",
      "slug": "button",
      "category": "action",
      "state": "flagged",
      "inPack": true
    },
    {
      "id": "TextInput",
      "slug": "textinput",
      "category": "input",
      "state": "flagged",
      "inPack": true
    },
    {
      "id": "Badge",
      "slug": "badge",
      "category": "content",
      "state": "flagged",
      "inPack": true
    },
    {
      "id": "Accordion",
      "slug": "accordion",
      "category": "content",
      "state": "flagged",
      "inPack": true
    },
    {
      "id": "Stack",
      "slug": "stack",
      "category": "layout",
      "state": "flagged",
      "inPack": true
    },
    {
      "id": "BenefitCard",
      "slug": "benefitcard",
      "category": "card",
      "state": "flagged",
      "inPack": true
    },
    {
      "id": "VStack",
      "slug": "vstack",
      "category": "layout",
      "state": "flagged",
      "inPack": true
    },
    {
      "id": "HStack",
      "slug": "hstack",
      "category": "layout",
      "state": "flagged",
      "inPack": true
    },
    {
      "id": "ButtonGroup",
      "slug": "buttongroup",
      "category": "action",
      "state": "flagged",
      "inPack": true
    },
    {
      "id": "IconButton",
      "slug": "iconbutton",
      "category": "action",
      "state": "flagged",
      "inPack": true
    },
    {
      "id": "Link",
      "slug": "link",
      "category": "navigation",
      "state": "flagged",
      "inPack": true
    },
    {
      "id": "FormField",
      "slug": "formfield",
      "category": "input",
      "state": "documented",
      "inPack": true
    },
    {
      "id": "CheckboxItem",
      "slug": "checkboxitem",
      "category": "input",
      "state": "flagged",
      "inPack": true
    },
    {
      "id": "Tabs",
      "slug": "tabs",
      "category": "navigation",
      "state": "documented",
      "inPack": true
    },
    {
      "id": "TabItem",
      "slug": "tabitem",
      "category": "navigation",
      "state": "documented",
      "inPack": true
    },
    {
      "id": "Nudge",
      "slug": "nudge",
      "category": "feedback",
      "state": "flagged",
      "inPack": true
    },
    {
      "id": "AppBar",
      "slug": "appbar",
      "category": "navigation",
      "state": "flagged",
      "inPack": true
    },
    {
      "id": "ActionFooter",
      "slug": "actionfooter",
      "category": "layout",
      "state": "flagged",
      "inPack": true
    },
    {
      "id": "Stepper",
      "slug": "stepper",
      "category": "navigation",
      "state": "documented",
      "inPack": true
    },
    {
      "id": "Step",
      "slug": "step",
      "category": "navigation",
      "state": "documented",
      "inPack": true
    },
    {
      "id": "Slider",
      "slug": "slider",
      "category": "input",
      "state": "flagged",
      "inPack": true
    },
    {
      "id": "CardAdvisory",
      "slug": "cardadvisory",
      "category": "card",
      "state": "flagged",
      "inPack": true
    },
    {
      "id": "PaymentFeedback",
      "slug": "paymentfeedback",
      "category": "feedback",
      "state": "documented",
      "inPack": true
    },
    {
      "id": "ModalSheet",
      "slug": "modalsheet",
      "category": "layout",
      "state": "flagged",
      "inPack": true
    },
    {
      "id": "SuggestiveSearch",
      "slug": "suggestivesearch",
      "category": "input",
      "state": "flagged",
      "inPack": true
    },
    {
      "id": "PdpCcCard",
      "slug": "pdpcccard",
      "category": "card",
      "state": "flagged",
      "inPack": true
    },
    {
      "id": "HoldingsCard",
      "slug": "holdingscard",
      "category": "card",
      "state": "flagged",
      "inPack": true
    },
    {
      "id": "CardBankAccount",
      "slug": "cardbankaccount",
      "category": "card",
      "state": "flagged",
      "inPack": true
    },
    {
      "id": "Overlay",
      "slug": "overlay",
      "category": "layout",
      "state": "documented",
      "inPack": true
    },
    {
      "id": "TransactionDetails",
      "slug": "transactiondetails",
      "category": "content",
      "state": "documented",
      "inPack": true
    },
    {
      "id": "ExpandableCheckbox",
      "slug": "expandablecheckbox",
      "category": "input",
      "state": "documented",
      "inPack": true
    },
    {
      "id": "FormUpload",
      "slug": "formupload",
      "category": "input",
      "state": "documented",
      "inPack": true
    },
    {
      "id": "BrandChip",
      "slug": "brandchip",
      "category": "content",
      "state": "flagged",
      "inPack": true
    },
    {
      "id": "NumberPagination",
      "slug": "numberpagination",
      "category": "navigation",
      "state": "flagged",
      "inPack": true
    },
    {
      "id": "TransactionStatus",
      "slug": "transactionstatus",
      "category": "feedback",
      "state": "flagged",
      "inPack": true
    },
    {
      "id": "RechargeCard",
      "slug": "rechargecard",
      "category": "card",
      "state": "flagged",
      "inPack": true
    },
    {
      "id": "AreaLineChart",
      "slug": "arealinechart",
      "category": "data",
      "state": "documented",
      "inPack": true
    },
    {
      "id": "AccountCard",
      "slug": "accountcard",
      "category": "card",
      "state": "flagged",
      "inPack": true
    },
    {
      "id": "Tooltip",
      "slug": "tooltip",
      "category": "content",
      "state": "flagged",
      "inPack": true
    },
    {
      "id": "OTP",
      "slug": "otp",
      "category": "input",
      "state": "flagged",
      "inPack": true
    },
    {
      "id": "DropdownInput",
      "slug": "dropdowninput",
      "category": "input",
      "state": "documented",
      "inPack": true
    },
    {
      "id": "Skeleton",
      "slug": "skeleton",
      "category": "feedback",
      "state": "documented",
      "inPack": true
    },
    {
      "id": "FullscreenModal",
      "slug": "fullscreenmodal",
      "category": "layout",
      "state": "flagged",
      "inPack": true
    },
    {
      "id": "DebitCard",
      "slug": "debitcard",
      "category": "card",
      "state": "documented",
      "inPack": true
    },
    {
      "id": "Card",
      "slug": "card",
      "category": "card",
      "state": "flagged",
      "inPack": true
    },
    {
      "id": "MessageField",
      "slug": "messagefield",
      "category": "input",
      "state": "flagged",
      "inPack": true
    },
    {
      "id": "Dropdown",
      "slug": "dropdown",
      "category": "input",
      "state": "flagged",
      "inPack": true
    },
    {
      "id": "ActionTile",
      "slug": "actiontile",
      "category": "action",
      "state": "flagged",
      "inPack": true
    },
    {
      "id": "ProfileCard",
      "slug": "profilecard",
      "category": "card",
      "state": "flagged",
      "inPack": true
    },
    {
      "id": "Breadcrumbs",
      "slug": "breadcrumbs",
      "category": "navigation",
      "state": "flagged",
      "inPack": true
    },
    {
      "id": "EmptyState",
      "slug": "emptystate",
      "category": "feedback",
      "state": "flagged",
      "inPack": true
    },
    {
      "id": "ValueBackMetric",
      "slug": "valuebackmetric",
      "category": "content",
      "state": "flagged",
      "inPack": true
    },
    {
      "id": "ProductOverview",
      "slug": "productoverview",
      "category": "content",
      "state": "flagged",
      "inPack": true
    },
    {
      "id": "Balance",
      "slug": "balance",
      "category": "content",
      "state": "documented",
      "inPack": true
    },
    {
      "id": "MerchantProfile",
      "slug": "merchantprofile",
      "category": "content",
      "state": "documented",
      "inPack": true
    },
    {
      "id": "ComparisonBar",
      "slug": "comparisonbar",
      "category": "action",
      "state": "documented",
      "inPack": true
    },
    {
      "id": "ListGroup",
      "slug": "listgroup",
      "category": "content",
      "state": "flagged",
      "inPack": true
    },
    {
      "id": "IconCapsule",
      "slug": "iconcapsule",
      "category": "content",
      "state": "flagged",
      "inPack": true
    },
    {
      "id": "Form",
      "slug": "form",
      "category": "input",
      "state": "flagged",
      "inPack": true
    },
    {
      "id": "ThreadHero",
      "slug": "threadhero",
      "category": "content",
      "state": "flagged",
      "inPack": true
    },
    {
      "id": "SegmentedTrack",
      "slug": "segmentedtrack",
      "category": "data",
      "state": "flagged",
      "inPack": true
    },
    {
      "id": "Toast",
      "slug": "toast",
      "category": "feedback",
      "state": "flagged",
      "inPack": true
    },
    {
      "id": "CardFinancialCondition",
      "slug": "cardfinancialcondition",
      "category": "card",
      "state": "flagged",
      "inPack": true
    },
    {
      "id": "Drawer",
      "slug": "drawer",
      "category": "layout",
      "state": "documented",
      "inPack": true
    },
    {
      "id": "NoteInput",
      "slug": "noteinput",
      "category": "input",
      "state": "documented",
      "inPack": true
    },
    {
      "id": "Attached",
      "slug": "attached",
      "category": "content",
      "state": "flagged",
      "inPack": true
    },
    {
      "id": "PlanComparisonCard",
      "slug": "plancomparisoncard",
      "category": "card",
      "state": "flagged",
      "inPack": true
    },
    {
      "id": "Disclaimer",
      "slug": "disclaimer",
      "category": "content",
      "state": "flagged",
      "inPack": true
    },
    {
      "id": "CheckboxGroup",
      "slug": "checkboxgroup",
      "category": "input",
      "state": "documented",
      "inPack": true
    },
    {
      "id": "Spinner",